{
  "$schema": "https://json-schema.org/draft/2020-12/schema",
  "$id": "https://ruiyaoe-hash.github.io/ai-radar/schemas/archive-day.schema.json",
  "title": "AI Radar Archive Day",
  "description": "One Beijing calendar day of event cards. published_at and ingested_at are recommended on new cards and optional on older cards; see card.schema.json.",
  "type": "object",
  "required": ["date", "count", "items"],
  "properties": {
    "date": { "type": "string", "pattern": "^[0-9]{4}-[0-9]{2}-[0-9]{2}$" },
    "count": { "type": "integer", "minimum": 0 },
    "schema_version": { "type": "integer" },
    "items": {
      "type": "array",
      "items": { "$ref": "card.schema.json" }
    }
  }
}
