{
  "date": "2026-10-11",
  "count": 6,
  "items": [
    {
      "schema_version": 2,
      "id": "evt-20261011-rea-claude-slides",
      "status": "confirmed",
      "tag": "工具",
      "lens": "工具",
      "priority": "P1",
      "title": "宝玉：用 REA 逆向 Claude Slides 编辑器，几乎完整功能",
      "date": "2026-10-11",
      "time": "10-11 13:18",
      "handle": "dotey",
      "url": "https://x.com/dotey/status/2109151666020794711",
      "objective": [
        "作者演示：先下载 Claude Slides 核心脚本与样式表，经 Codex 安装 REA，再用 REA Skill 逆向混淆代码",
        "称逆向后的 Slides 编辑器「几乎完整功能」；引用早前 REA 接到 Claude Code/Codex/Cursor 的帖",
        "强调用法仅为个人参考，不一定是最佳实践"
      ],
      "sources": [
        {
          "url": "https://x.com/dotey/status/2109151666020794711",
          "handle": "dotey",
          "role": "analysis"
        }
      ],
      "judgment": [
        "REA 从「接上 agent IDE」走到具体产品逆向案例，说明逆向-as-skill 对闭源 Web 应用的可复用路径在打开"
      ],
      "judgment_label": "主观判断",
      "try_url": "https://github.com/search?q=REA+MCP",
      "access": "开源",
      "integration": "MCP / Claude Code / Codex / Cursor",
      "first_step": "安装 MCP 后对本地二进制跑一轮只读逆向",
      "alternatives": [
        "Ghidra 手工",
        "IDA + 脚本"
      ],
      "tool_radar": "评估",
      "shift": "midday",
      "lead_lag_hours": 0.2,
      "lead_lag_basis": "assumed_next_digest"
    },
    {
      "schema_version": 2,
      "id": "evt-20261011-chollet-kerashub-jax-tpu-llm",
      "status": "confirmed",
      "tag": "工具",
      "lens": "工具",
      "priority": "P1",
      "title": "Chollet：用 KerasHub + JAX + TPU 做 LLM 后训练实验，考虑开源部分",
      "date": "2026-10-11",
      "time": "10-11 09:39",
      "handle": "fchollet",
      "url": "https://x.com/fchollet/status/2109096597011534242",
      "objective": [
        "François Chollet 称近期用 KerasHub + JAX + TPU 做了大量 LLM 后训练实验，并表示「玩得很开心」",
        "他表示可能会开源其中一部分（Might open-source some of that）"
      ],
      "sources": [
        {
          "url": "https://x.com/fchollet/status/2109096597011534242",
          "handle": "fchollet",
          "role": "report"
        }
      ],
      "judgment": [
        "若落地，会给「非 PyTorch 默认栈」的后训练/实验路径多一个可对标的开源入口，值得盯仓库动态"
      ],
      "judgment_label": "主观判断",
      "shift": "midday",
      "lead_lag_hours": 3.85,
      "lead_lag_basis": "assumed_next_digest"
    },
    {
      "schema_version": 2,
      "id": "evt-20261011-jiuwenswarm-harness",
      "status": "confirmed",
      "tag": "工具",
      "lens": "工具",
      "priority": "P0",
      "title": "华为开源多智能体框架 JiuwenSwarm：纯 Harness、模型无关",
      "date": "2026-10-11",
      "time": "10-11 08:46",
      "handle": "shao__meng",
      "url": "https://x.com/shao__meng/status/2109083154682351988",
      "objective": [
        "邵萌转发梳理：华为/openJiuwen 开源多智能体协作框架「JiuwenSwarm」，口号「理解意图、自主进化」",
        "架构：Leader 分解任务、组建专家团队、调度技能与工具，交付端到端结果；不内置模型，属纯 Harness",
        "可对接 OpenAI 兼容 API、华为云 MaaS 及本地模型；GitHub openJiuwen-ai/jiuwenswarm（Apache-2.0）"
      ],
      "sources": [
        {
          "url": "https://x.com/shao__meng/status/2109083154682351988",
          "handle": "shao__meng",
          "role": "analysis"
        }
      ],
      "judgment": [
        "国内大厂把「多 agent harness」开源且强调模型无关，对 OPC 可对比 Claude Code / 开源 swarm 路线的分发与渠道（飞书/小艺）"
      ],
      "judgment_label": "主观判断",
      "try_url": "https://github.com/openJiuwen-ai/jiuwenswarm",
      "access": "开源 Apache-2.0",
      "integration": "OpenAI 兼容 API / 华为云 MaaS / 本地模型",
      "first_step": "clone 仓库，用兼容 API 跑通 Leader→专家示例",
      "alternatives": [
        "Claude Code swarm",
        "CrewAI",
        "AutoGen"
      ],
      "tool_radar": "试用",
      "so_what": {
        "lens": "工具",
        "impact": "国内大厂开源模型无关 multi-agent harness，可对比 Claude Code / 开源 swarm 的分发路径",
        "action": "试用",
        "window": "本周内可 clone 试跑",
        "confidence": "中",
        "falsifier": "若仓库无实质更新/示例无法对接 OpenAI 兼容 API，或仅为营销壳，则此判断作废",
        "thesis_id": "T-001"
      },
      "shift": "midday",
      "lead_lag_hours": 4.73,
      "lead_lag_basis": "assumed_next_digest"
    },
    {
      "schema_version": 2,
      "id": "evt-20261011-reflection-ai-beam",
      "status": "rumor",
      "tag": "收购",
      "lens": "赛道",
      "priority": "P0",
      "title": "传闻：英伟达洽谈收购或加码 Reflection AI（Beam 刚火）",
      "date": "2026-10-11",
      "time": "10-11 06:51",
      "handle": "dongxi_nlp",
      "url": "https://x.com/dongxi_nlp/status/2109054116458566094",
      "objective": [
        "东锡梳理：Beam 被视为西方开源模型重要突破后不久，传出 NVIDIA 收购 Reflection 的消息",
        "外媒/早报口径多为「洽谈收购或追加投资」；3 月估值约 $250 亿；英伟达已投约 $8 亿",
        "同脉络支出：Essential AI / Poolside / Reflection；分发 Hugging Face；infra Nexusflow / Groq——不止卖卡"
      ],
      "sources": [
        {
          "url": "https://x.com/dongxi_nlp/status/2109054116458566094",
          "handle": "dongxi_nlp",
          "role": "report"
        }
      ],
      "judgment": [],
      "so_what": {
        "lens": "赛道",
        "impact": "若属实，英伟达在开源模型股权布局继续加码，影响开源分发与 infra 并购预期",
        "action": "观察",
        "window": "未来 2–6 周",
        "confidence": "低",
        "falsifier": "若官方否认洽谈或无独立一手确认，且 Beam 热度消退后无跟进，则此判断作废",
        "thesis_id": "T-004"
      },
      "shift": "morning",
      "lead_lag_hours": 1.15,
      "lead_lag_basis": "assumed_next_digest"
    },
    {
      "schema_version": 2,
      "id": "evt-20261011-nathan-lambert-huggingface",
      "status": "confirmed",
      "tag": "行业",
      "lens": "赛道",
      "priority": "P1",
      "title": "Nathan Lambert：追踪的开源大模型 HuggingFace 下载量持续下滑",
      "date": "2026-10-11",
      "time": "10-11 00:13",
      "handle": "natolambert",
      "url": "https://x.com/natolambert/status/2108954173316178231",
      "objective": [
        "一度见约 30% 计数口径变化后的下跌，但趋势仍在延续；征询社区解释",
        "Clem 回应：Hub 总 DAU 仍在涨；其图只跟踪约 2000 个模型，口径需对齐"
      ],
      "sources": [
        {
          "url": "https://x.com/natolambert/status/2108954173316178231",
          "handle": "natolambert",
          "role": "analysis"
        }
      ],
      "judgment": [],
      "shift": "morning",
      "lead_lag_hours": 7.78,
      "lead_lag_basis": "assumed_next_digest"
    },
    {
      "schema_version": 2,
      "id": "evt-20261011-chollet-ai-token",
      "status": "confirmed",
      "tag": "观点",
      "lens": "模式",
      "priority": "P1",
      "title": "Chollet：AI 从「逐 token 补全」转向「即时合成推理链」",
      "date": "2026-10-11",
      "time": "10-11 00:05",
      "handle": "fchollet",
      "url": "https://x.com/fchollet/status/2108951977904517409",
      "objective": [
        "一张图概括 2025–2026 主线：transductive → inductive（on-the-fly reasoning chain synthesis）",
        "他称之为 coding agents 能工作的关键故事"
      ],
      "sources": [
        {
          "url": "https://x.com/fchollet/status/2108951977904517409",
          "handle": "fchollet",
          "role": "report"
        }
      ],
      "judgment": [],
      "shift": "morning",
      "lead_lag_hours": 7.92,
      "lead_lag_basis": "assumed_next_digest"
    }
  ],
  "schema_version": 2
}
