{
  "date": "2026-10-10",
  "count": 4,
  "items": [
    {
      "schema_version": 2,
      "id": "evt-20261010-uber-agent-rag-91",
      "status": "confirmed",
      "tag": "案例",
      "lens": "模式",
      "priority": "P1",
      "title": "Uber 法务红线 Agent：从 RAG 失败到 91% 准确率的四次演进",
      "date": "2026-10-10",
      "time": "10-10 16:23",
      "handle": "shao__meng",
      "url": "https://x.com/shao__meng/status/2108835904534290445",
      "objective": [
        "Word 插件交付；AI 只建议、人做决策；真实谈判轨迹驱动「从决策学」",
        "四版：朴素 RAG 失败 → 反馈闭环 → 语气分层（律师管 prompt）→ agentic 起草反提案",
        "合同审核时间降 20%+；获 2026 ALM Legalweek 年度最具创新力法务部"
      ],
      "sources": [
        {
          "url": "https://x.com/shao__meng/status/2108835904534290445",
          "handle": "shao__meng",
          "role": "analysis"
        }
      ],
      "judgment": []
    },
    {
      "schema_version": 2,
      "id": "evt-20261010-claude-design-claude-12-14",
      "status": "confirmed",
      "tag": "产品",
      "lens": "工具",
      "priority": "P1",
      "title": "Claude Design 并入 Claude：独立站点将于 12/14 关闭",
      "date": "2026-10-10",
      "time": "10-10 16:11",
      "handle": "shao__meng",
      "url": "https://x.com/shao__meng/status/2108832696117952600",
      "objective": [
        "设计/设计系统/PPT 以对话内 artifact 形式创建；Free 到 Enterprise 均可",
        "9/16 起对话内已可用；claude.ai/design 将跳转到 Claude"
      ],
      "sources": [
        {
          "url": "https://x.com/shao__meng/status/2108832696117952600",
          "handle": "shao__meng",
          "role": "analysis"
        }
      ],
      "judgment": []
    },
    {
      "schema_version": 2,
      "id": "evt-20261010-mimo-v2-6-260-rl",
      "status": "confirmed",
      "tag": "模型",
      "lens": "赛道",
      "priority": "P0",
      "title": "小米 MiMo-V2.6 技术报告：260 万美元 RL 三维扩展进前沿梯队",
      "date": "2026-10-10",
      "time": "10-10 15:57",
      "handle": "shao__meng",
      "url": "https://x.com/shao__meng/status/2108829340704162034",
      "objective": [
        "主张：提升智能最有效路径是系统性扩展 RL（大批次 × 多样环境 × 更贵 grader），而非继续堆预训练",
        "Pro 1.02T MoE（激活 42B）RL 约 $260 万；Flash 310B（激活 15B）约 $90 万；相对 V2.5 多项基准大幅跃升",
        "要点：冻结 MoE router 防负载崩塌；GRS/GAR 把 grader 当第三条算力轴；开源蒸馏 9B + 环境 + RL 框架"
      ],
      "sources": [
        {
          "url": "https://x.com/shao__meng/status/2108829340704162034",
          "handle": "shao__meng",
          "role": "analysis"
        }
      ],
      "judgment": [],
      "so_what": {
        "lens": "赛道",
        "impact": "开源侧把「RL 三维扩展」成本数字公开，影响对标闭源 grader 投入叙事",
        "action": "观察",
        "window": "未来 1–2 个季度",
        "confidence": "中",
        "falsifier": "若后续开源复现无法接近报告基准，或官方撤回/大幅修正 RL 成本口径，则此判断作废",
        "thesis_id": "T-002"
      }
    },
    {
      "schema_version": 2,
      "id": "evt-20261010-rea-claude-code-codex-cursor",
      "status": "confirmed",
      "tag": "工具",
      "lens": "工具",
      "priority": "P1",
      "title": "REA：把逆向分析接到 Claude Code / Codex / Cursor 等智能体",
      "date": "2026-10-10",
      "time": "10-10 13:39",
      "handle": "dotey",
      "url": "https://x.com/dotey/status/2108794629172682783",
      "objective": [
        "开源 MCP：无源码时让 agent 拆程序、给证据、再在你项目里复刻类似功能",
        "覆盖原生（Hopper/Ghidra/IDA）、Electron ASAR、.NET、APK、固件、合约字节码等；分析在本机",
        "GitHub 已约 5 万星；合规与授权由使用者自负"
      ],
      "sources": [
        {
          "url": "https://x.com/dotey/status/2108794629172682783",
          "handle": "dotey",
          "role": "analysis"
        }
      ],
      "judgment": [],
      "try_url": "https://github.com/search?q=REA+MCP",
      "access": "开源",
      "integration": "MCP / Claude Code / Codex / Cursor",
      "first_step": "安装 MCP 后对本地二进制跑一轮只读逆向",
      "alternatives": [
        "Ghidra 手工",
        "IDA + 脚本"
      ],
      "tool_radar": "评估"
    }
  ],
  "schema_version": 2
}
