{
  "date": "2026-10-23",
  "count": 2,
  "schema_version": 1,
  "items": [
    {
      "schema_version": 2,
      "id": "evt-20261023-openai-decisions-api-ga",
      "status": "confirmed",
      "tag": "发布",
      "lens": "工具",
      "priority": "P0",
      "title": "OpenAI Decisions API 正式可用：面向有边界答案的近实时决策接口",
      "date": "2026-10-23",
      "time": "10-23 03:00",
      "handle": "OpenAI",
      "url": "https://openai.com/index/decisions-api",
      "published_at": "2026-10-22T19:00:00Z",
      "ingested_at": "2026-10-23T00:10:00Z",
      "candidate_id": "cand-20261022-5b11ed122be0",
      "promotion_path": "normal",
      "objective": [
        "OpenAI 在 2026 年 10 月 22 日宣布 Decisions API（决策接口）结束公开测试、正式可用。它跑在 GPT-6 Luna 上，专门回答有边界的问题：给应用和智能体做分类、路由或下一步动作选择。官方写它可比同一模型走 Responses API 快约 10 倍，适合热路径上的近实时判断。",
        "相对公开测试版，正式版新增原生 GPT-Live（实时语音）集成、复用上下文的提示缓存、美国与欧盟推理驻留，并支持原生 JSON 输入、在单题说明里带图片，以及每请求最多 400 道题（测试版上限的两倍）。计费只收输入：非缓存约每百万输入 token 0.10 美元，缓存输入约 0.01 美元；不收输出 token 费。",
        "官方开发者文档写明走 POST /v1/decisions，当前模型是 gpt-6-luna。答案类型有三种：predicate（条件成立概率）、choice（从你给定选项里选一个）、score（按量表打分）。Box、Datadog、Ramp、Sierra、Speak 等客户案例写的是毫秒级路由、风险打分和成本归因。若你的产品里反复做有限答案的判断，这周用同一批真实样例在 Decisions Playground 或接口里对打现有 Responses/聊天路径。"
      ],
      "sources": [
        {
          "url": "https://openai.com/index/decisions-api",
          "handle": "OpenAI",
          "role": "primary"
        },
        {
          "url": "https://developers.openai.com/api/docs/guides/decisions",
          "handle": "OpenAI",
          "role": "primary"
        },
        {
          "url": "https://techcrunch.com/2026/10/22/openai-makes-its-jev-competitor-widely-available-as-decision-model-competition-heats-up/",
          "handle": "TechCrunch",
          "role": "report"
        }
      ],
      "shift": "morning",
      "try_url": "https://developers.openai.com/api/docs/guides/decisions",
      "access": "正式可用。文档与计费见 OpenAI 开发者站 Decisions 指南与定价页。走 API 密钥调用 POST /v1/decisions，模型 gpt-6-luna。Playground 可先用自有文本或图片试跑。",
      "integration": "独立 Decisions 端点，不是完整聊天回复。可嵌进应用编排、智能体路由，以及 GPT-Live 会话触发器。美国与欧盟驻留、符合条件的零数据保留见官方数据控制说明。",
      "first_step": "挑一条产品里反复出现、答案集合有限的判断（分类、路由或是否继续）。在 Decisions Playground 或按开发者指南发第一条请求，用同一批真实样例对照现在的 Responses/聊天路径看延迟和费用。",
      "alternatives": [
        "继续用 Responses API / 聊天模型做同题（更慢、通常更贵）",
        "自建或第三方 decision / System-1 小模型（需自行对齐延迟与准确率）"
      ],
      "tool_radar": "试用",
      "so_what": {
        "lens": "工具",
        "impact": "如果你在做应用或智能体，热路径上有大量「有限答案」的分类、路由或下一步选择，这周用同一批真实样例把 Decisions API 和现在的 Responses/聊天路径对打一遍，看延迟和费用是否值得换。",
        "action": "试用",
        "window": "这周用同一批样例对打；正式可用后即可接生产。",
        "confidence": "高",
        "falsifier": "如果在你的真实样例上，Decisions API 的准确率明显低于现有路径，或延迟/费用没有可感知的改善，就收回「这周必须放进对照表」。"
      }
    },
    {
      "schema_version": 2,
      "id": "evt-20261023-claude-auto-mode-default",
      "status": "confirmed",
      "tag": "发布",
      "lens": "工具",
      "priority": "P0",
      "title": "Claude 网页/桌面/手机：Pro、Max、Team 新会话下周默认自动模式",
      "date": "2026-10-23",
      "time": "10-23 04:04",
      "handle": "claudeai",
      "url": "https://claude.com/resources/articles/auto-mode-default-in-claude-code",
      "published_at": "2026-10-22T20:04:24Z",
      "ingested_at": "2026-10-23T00:10:00Z",
      "candidate_id": "cand-20261023-7f31c4dda252",
      "promotion_path": "normal",
      "objective": [
        "Anthropic 在 2026 年 10 月 22 日更新说明：从下周起，多数 Claude 应用（网页、桌面、手机）上，Pro、Max、Team 套餐的新会话将默认进入自动模式（auto mode）。不再逐步弹窗让你点同意，而是由自动检查放行安全动作、拦住高风险动作；可随时切回手动。企业版管理员会在其组织默认改成自动模式之前收到邮件。",
        "官方文章写，受控试验里 1053 名付费测试者人工只拦下约 13.6% 的危险命令，自动模式拦下约 89%。人工对权限提示的同意率约 97%。连续三次被拦或单会话累计二十次被拦时，会退回手动审批。Enterprise、Claude API 以及云上托管通道目前仍以自愿开启为主，计划约一个月内再扩。",
        "若你本周用 Claude 网页、桌面或手机做带工具调用的长任务，先确认默认权限模式；需要逐步确认时，会话里切回手动，或让管理员用 managed settings 钉死 defaultMode / disableAutoMode。高风险改生产环境时，官方仍建议自己再看一遍动作。"
      ],
      "sources": [
        {
          "url": "https://claude.com/resources/articles/auto-mode-default-in-claude-code",
          "handle": "claudeai",
          "role": "primary"
        },
        {
          "url": "https://x.com/claudeai/status/2113360845409583307",
          "handle": "claudeai",
          "role": "primary"
        }
      ],
      "shift": "morning",
      "try_url": "https://claude.com/resources/articles/auto-mode-default-in-claude-code",
      "access": "Pro、Max、Team：下周起多数 Claude 应用的新会话默认自动模式；已钉死其他默认的可能收到一次性提示。Enterprise 与 API/云托管通道暂仍自愿开启。客户端内可切换模式。",
      "integration": "权限模式写在 Claude 应用与 Claude Code 设置里。管理员可用 managed settings 的 defaultMode 或 disableAutoMode。自动模式分类器按工具调用计少量额外 token；Pro/Max/Team 的 Claude Code 用户官方写明不再收这笔分类器费用。",
      "first_step": "打开 Claude 网页、桌面或手机，看当前默认权限模式。若下周不想默认自动跑工具，现在切到手动并钉死；Team 管理员先核对 managed settings。",
      "alternatives": [
        "继续手动审批每一步",
        "Enterprise / API 通道暂保持自愿开启，等管理员通知后再改"
      ],
      "tool_radar": "评估",
      "so_what": {
        "lens": "工具",
        "impact": "如果你用 Claude Pro、Max 或 Team 的网页、桌面或手机做带工具的事，下周新会话会默认少打断、多自动执行。这周先确认要不要钉死手动；Team 管理员先看组织默认。",
        "action": "评估",
        "window": "下周默认生效前，先设好个人或组织的权限默认。",
        "confidence": "高",
        "falsifier": "如果默认滚动被推迟、你的套餐或客户端不在「多数 Claude 应用」范围内，或你已钉死且不会被改写的手动默认，就收回「这周必须先改权限默认」。"
      }
    }
  ]
}
